[
  {
    "schemaVersion": 1,
    "id": "iso-26262-2018",
    "name": "ISO 26262 functional safety",
    "version": "2018",
    "domain": "Automotive functional safety",
    "jurisdiction": "International",
    "sourceLabel": "ISO 26262:2018 overview and parts catalogue",
    "sourceUrl": "https://www.iso.org/publication/PUB200262.html",
    "copyrightNotice": "ISO standard text is copyrighted and is not bundled. Obtain the official standard for authoritative requirements.",
    "disclaimer": "This original readiness profile is not the ISO standard, legal advice, certification, or a determination of conformity. Evidence matches require qualified functional-safety review.",
    "controls": [
      { "id": "fs-governance", "reference": "Safety lifecycle governance", "title": "Safety plan and responsibilities", "objective": "Maintain an approved safety plan, lifecycle responsibilities, independence, and escalation routes.", "assurance": "mixed", "check": { "fileGroups": [["*safety*plan*", "*functional-safety*management*", "*safety*governance*"]], "manual": true } },
      { "id": "fs-item-hara", "reference": "Concept phase", "title": "Item definition and hazard analysis", "objective": "Define the item and retain reviewable hazard analysis and risk classification evidence.", "assurance": "mixed", "check": { "fileGroups": [["*item*definition*"], ["*hara*", "*hazard*analysis*", "*risk*assessment*"]], "manual": true } },
      { "id": "fs-requirements", "reference": "Safety requirements", "title": "Safety goals and traceable requirements", "objective": "Trace safety goals through functional, technical, hardware, and software requirements.", "assurance": "mixed", "check": { "fileGroups": [["*safety*goal*", "*safety*requirements*"], ["*traceability*", "*requirements*matrix*"]], "manual": true } },
      { "id": "fs-verification", "reference": "Product development", "title": "Verification and validation evidence", "objective": "Retain review, test, integration, validation, and coverage evidence tied to safety requirements.", "assurance": "mixed", "check": { "fileGroups": [["*verification*plan*", "*validation*plan*", "*test*plan*"], ["*test*report*", "*validation*report*", "*coverage*"]], "runKinds": ["source", "dependencies", "binary"], "manual": true } },
      { "id": "fs-change", "reference": "Supporting processes", "title": "Configuration and change control", "objective": "Control baselines, safety-impacting changes, problem resolution, and tool confidence evidence.", "assurance": "mixed", "check": { "fileGroups": [["*configuration*management*", "*change*management*", "*change*control*"], ["*tool*qualification*", "*tool*confidence*"]], "manual": true } },
      { "id": "fs-confirmation", "reference": "Confirmation measures", "title": "Independent confirmation and safety case", "objective": "Record independent reviews, audits, assessments, and the integrated safety case.", "assurance": "humanAttestation", "check": { "manual": true } }
    ]
  },
  {
    "schemaVersion": 1,
    "id": "iso-sae-21434-2021",
    "name": "ISO/SAE 21434 automotive cybersecurity",
    "version": "2021",
    "domain": "Automotive cybersecurity engineering",
    "jurisdiction": "International",
    "sourceLabel": "ISO/SAE 21434:2021 official overview",
    "sourceUrl": "https://www.iso.org/standard/70918.html",
    "copyrightNotice": "ISO/SAE standard text is copyrighted and is not bundled. Obtain the official standard for authoritative requirements.",
    "disclaimer": "This original readiness profile is not the ISO/SAE standard, legal advice, certification, or a determination of conformity. Evidence matches require qualified cybersecurity review.",
    "controls": [
      { "id": "cs-governance", "reference": "Cybersecurity management", "title": "Cybersecurity governance", "objective": "Define policy, responsibilities, competence, quality management, and cybersecurity planning.", "assurance": "mixed", "check": { "fileGroups": [["*cybersecurity*policy*", "*security*policy*"], ["*cybersecurity*plan*", "*security*plan*"]], "manual": true } },
      { "id": "cs-tara", "reference": "Concept phase", "title": "Assets, threats, and risk analysis", "objective": "Maintain item definition, asset inventory, threat scenarios, attack paths, risk decisions, and cybersecurity goals.", "assurance": "mixed", "check": { "fileGroups": [["*item*definition*", "*asset*inventory*"], ["*tara*", "*threat*model*", "*attack*path*"], ["*cybersecurity*goal*", "*security*requirements*"]], "manual": true } },
      { "id": "cs-development", "reference": "Product development", "title": "Secure development and verification", "objective": "Retain secure design, implementation, review, testing, and vulnerability analysis evidence.", "assurance": "mixed", "check": { "fileGroups": [["*secure*design*", "*security*architecture*"], ["*penetration*test*", "*security*test*", "*verification*"]], "runKinds": ["source", "dependencies", "binary", "firmware"], "manual": true } },
      { "id": "cs-supply-chain", "reference": "Distributed activities", "title": "Supplier and interface controls", "objective": "Document cybersecurity interfaces, supplier expectations, dependencies, and software inventory.", "assurance": "mixed", "check": { "fileGroups": [["*supplier*security*", "*interface*agreement*", "*cybersecurity*interface*"], ["*sbom*", "*cyclonedx*", "*spdx*"]], "runKinds": ["dependencies", "binary"], "manual": true } },
      { "id": "cs-operations", "reference": "Post-development", "title": "Monitoring, incident, and update lifecycle", "objective": "Operate vulnerability monitoring, incident response, field action, and secure update processes.", "assurance": "mixed", "check": { "fileGroups": [["*vulnerability*management*", "*monitoring*plan*"], ["*incident*response*"], ["*software*update*", "*secure*update*"]], "manual": true } },
      { "id": "cs-case", "reference": "Cybersecurity case", "title": "Cybersecurity case and release judgment", "objective": "Integrate claims, evidence, residual risk acceptance, and release approval into a reviewable cybersecurity case.", "assurance": "humanAttestation", "check": { "manual": true } }
    ]
  },
  {
    "schemaVersion": 1,
    "id": "unece-r155",
    "name": "UNECE Regulation No. 155",
    "version": "Current consolidated publication",
    "domain": "Vehicle cybersecurity and CSMS",
    "jurisdiction": "UNECE contracting parties",
    "sourceLabel": "UNECE UN Regulation No. 155",
    "sourceUrl": "https://unece.org/transport/documents/2021/03/standards/un-regulation-no-155-cyber-security-and-cyber-security",
    "copyrightNotice": "Use the official UNECE regulation and applicable type-approval guidance as the authoritative source.",
    "disclaimer": "This readiness profile is not type approval, legal advice, certification, or a determination of regulatory conformity. Applicability and evidence require competent legal and type-approval review.",
    "controls": [
      { "id": "r155-csms", "reference": "CSMS", "title": "Cybersecurity management system", "objective": "Maintain governed, auditable cybersecurity processes across development, production, and post-production.", "assurance": "mixed", "check": { "fileGroups": [["*csms*", "*cybersecurity*management*system*"], ["*cybersecurity*policy*"]], "manual": true } },
      { "id": "r155-risk", "reference": "Vehicle risk management", "title": "Vehicle threats, risks, and mitigations", "objective": "Identify vehicle threats and attack paths, assess risks, select mitigations, and verify effectiveness.", "assurance": "mixed", "check": { "fileGroups": [["*tara*", "*vehicle*threat*", "*attack*path*"], ["*risk*treatment*", "*mitigation*"]], "manual": true } },
      { "id": "r155-testing", "reference": "Verification", "title": "Security testing and evidence", "objective": "Retain vehicle and component testing evidence for implemented cybersecurity measures.", "assurance": "mixed", "check": { "fileGroups": [["*penetration*test*", "*cybersecurity*test*", "*security*validation*"]], "runKinds": ["source", "dependencies", "binary", "firmware"], "manual": true } },
      { "id": "r155-monitoring", "reference": "Monitoring and response", "title": "Detection, monitoring, and incident response", "objective": "Monitor relevant threats and vulnerabilities and maintain response, reporting, and remediation processes.", "assurance": "mixed", "check": { "fileGroups": [["*vulnerability*monitoring*", "*threat*monitoring*"], ["*incident*response*", "*incident*management*"]], "manual": true } },
      { "id": "r155-supply", "reference": "Supply chain", "title": "Supplier cybersecurity dependencies", "objective": "Manage supplier, service-provider, and component cybersecurity dependencies with traceable agreements.", "assurance": "mixed", "check": { "fileGroups": [["*supplier*security*", "*supplier*cybersecurity*", "*interface*agreement*"], ["*sbom*", "*cyclonedx*", "*spdx*"]], "manual": true } },
      { "id": "r155-approval", "reference": "Type approval evidence", "title": "Approval scope and representative evidence", "objective": "Confirm vehicle-type scope, authority expectations, declarations, and representative evidence through qualified review.", "assurance": "humanAttestation", "check": { "manual": true } }
    ]
  },
  {
    "schemaVersion": 1,
    "id": "unece-r156",
    "name": "UNECE Regulation No. 156",
    "version": "Current consolidated publication",
    "domain": "Vehicle software update management",
    "jurisdiction": "UNECE contracting parties",
    "sourceLabel": "UNECE UN Regulation No. 156",
    "sourceUrl": "https://unece.org/transport/documents/2021/03/standards/un-regulation-no-156-software-update-and-software-update",
    "copyrightNotice": "Use the official UNECE regulation and applicable type-approval guidance as the authoritative source.",